### ISSUE TITLE
Failed to parse the outcoming heartbeat packet in 9.9.12-25493

### ISSUE THREAD

**Issue by pk5ls20** [pk5ls20/wireshark_ntqq_protocol_plugin#1]
## Full frame
```shell
Frame 18446: 174 bytes on wire (1392 bits), 174 bytes captured (1392 bits) on interface <hidden>, id 0
Ethernet II, Src: <hidden> (<hidden>), Dst: <hidden> (<hidden>)
Internet Protocol Version 4, Src: <hidden>, Dst: <hidden>
Transmission Control Protocol, Src Port: 51232, Dst Port: 8080, Seq: 114825, Ack: 364479, Len: 120
NTQQ Protocol
    sso_send_length: 120
    sso_head_d2: <hidden>
Lua Error: ...k5ls\AppData\Roaming\Wireshark\plugins\ntqq_protocol.lua:32: attempt to perform arithmetic on a nil value
    [Expert Info (Error/Undecoded): Lua Error: ...k5ls\AppData\Roaming\Wireshark\plugins\ntqq_protocol.lua:32: attempt to perform arithmetic on a nil value]
        [Lua Error: ...k5ls\AppData\Roaming\Wireshark\plugins\ntqq_protocol.lua:32: attempt to perform arithmetic on a nil value]
        [Severity level: Error]
        [Group: Undecoded]
Lua Traceback
    stack traceback:
     ...k5ls\AppData\Roaming\Wireshark\plugins\ntqq_protocol.lua:32: in function 'read_u32'
     ...k5ls\AppData\Roaming\Wireshark\plugins\ntqq_protocol.lua:112: in function 'read_bytes_with_length'
     ...k5ls\AppData\Roaming\Wireshark\plugins\ntqq_protocol.lua:131: in function 'read_string_with_length'
     ...k5ls\AppData\Roaming\Wireshark\plugins\ntqq_protocol.lua:324: in function 'ntqq_protocol_send_dissector'
     ...k5ls\AppData\Roaming\Wireshark\plugins\ntqq_protocol.lua:376: in function <...k5ls\AppData\Roaming\Wireshark\plugins\ntqq_protocol.lua:370>
```

## Raw Packet
`<hidden>`
